{
  "format": "org.trenchbroom.tbscene",
  "version": 1,
  "documentId": "urn:uuid:482a7f63-95ec-4dc4-af62-e4c36a7a0a36",
  "coordinateSystem": {
    "handedness": "right",
    "up": "z",
    "unit": "metre",
    "metresPerUnit": 1
  },
  "entries": [
    {
      "id": "urn:uuid:9b56bd72-370d-491d-9eef-778d0f44bbd1",
      "kind": "mesh",
      "path": "meshes/facade.tbm",
      "offset": 0,
      "length": 0,
      "sha256": "sha256:e3b0c44298fc1c149afbf4c8996fb92427ae41e4649b934ca495991b7852b855"
    },
    {
      "id": "urn:uuid:8664531e-4e16-4661-84f9-a7a389253b9d",
      "kind": "solid",
      "path": "records/solids.ndjson",
      "offset": 0,
      "length": 0,
      "sha256": "sha256:e3b0c44298fc1c149afbf4c8996fb92427ae41e4649b934ca495991b7852b855"
    },
    {
      "id": "urn:uuid:aceb67aa-f865-4d4f-83a8-67f0aafad9ba",
      "kind": "entity",
      "path": "records/entities.ndjson",
      "offset": 0,
      "length": 0,
      "sha256": "sha256:e3b0c44298fc1c149afbf4c8996fb92427ae41e4649b934ca495991b7852b855"
    },
    {
      "id": "urn:uuid:ca4e1f1c-543d-4690-a6ea-aad63cd0e249",
      "kind": "component",
      "path": "records/components.ndjson",
      "offset": 0,
      "length": 0,
      "sha256": "sha256:e3b0c44298fc1c149afbf4c8996fb92427ae41e4649b934ca495991b7852b855",
      "extensions": {
        "org.trenchbroom.fixture": {
          "components": ["door", "light", "waterVolume", "animatedProp"]
        }
      }
    }
  ],
  "requiredExtensions": {},
  "extensions": {
    "org.trenchbroom.fixture": {
      "externalAsset": "asset://example/materials/stone.png",
      "provenance": "source-zone:example/triangle/7",
      "referenceRoles": ["reference", "candidate", "observation"],
      "acceptanceAssertion": "playerClearance"
    }
  },
  "integrity": {
    "algorithm": "sha256",
    "document": "sha256:0000000000000000000000000000000000000000000000000000000000000000",
    "entries": {
      "meshes/facade.tbm": "sha256:e3b0c44298fc1c149afbf4c8996fb92427ae41e4649b934ca495991b7852b855",
      "records/components.ndjson": "sha256:e3b0c44298fc1c149afbf4c8996fb92427ae41e4649b934ca495991b7852b855",
      "records/entities.ndjson": "sha256:e3b0c44298fc1c149afbf4c8996fb92427ae41e4649b934ca495991b7852b855",
      "records/solids.ndjson": "sha256:e3b0c44298fc1c149afbf4c8996fb92427ae41e4649b934ca495991b7852b855"
    }
  }
}
